{
  "attempt": 31246781082,
  "base_sha": "1111111111111111111111111111111111111111",
  "case_id": "PRR-C01",
  "comparison_revision": "pr-review-core-r2",
  "fixture_revision": "r1",
  "github_run_id": "31246781082",
  "head_sha": "1111111111111111111111111111111111111112",
  "model": {
    "reported": "claude-sonnet-5",
    "requested": "claude-sonnet-5"
  },
  "profile_id": "pr-review-agentic-retrieval-c01-qualification-n2-r1",
  "quality": {
    "category_accuracy": 1,
    "clean_control_major_false_positive": 0,
    "expected_findings": 1,
    "false_negative": 0,
    "false_positive": 1,
    "line_accuracy": 1,
    "observed": true,
    "path_accuracy": 1,
    "review_contract_violation": 0,
    "scope_violation_count": 0,
    "summary_complete": true,
    "true_positive": 1
  },
  "quality_rating_contract": "pr-review-finding-quality-v1",
  "quality_score": 4,
  "repetition": 2,
  "result": "pass",
  "result_id": "pr-review-core-r2:PRR-C01:agentic-retrieval:r2:a31246781082",
  "reviewer_executor": {
    "claude_authentication": "claude_code_oauth_token",
    "github_authentication": "job_scoped_github_token",
    "identity": "anthropics/claude-code-action",
    "permission_profile": "review-read-only-r1",
    "resolved_at": "2026-08-08",
    "resolved_from": "refs/tags/v1^{}",
    "revision": "6b082c41935b4c8a3b8b0ef85ba4ba4d9eeb8975",
    "sandbox": "claude-code-action-default",
    "timeout_seconds": 900,
    "tool_policies": {
      "agentic-retrieval": "fixture-tool-read-only-r1",
      "deterministic-input": "prepared-input-read-only-r1"
    },
    "type": "github_action"
  },
  "runtime": {
    "input_tokens": 145223,
    "output_tokens": 7424,
    "reported_cost_usd": 0.1879372,
    "total_tokens": 152647,
    "turns": 9
  },
  "schema_version": 2,
  "timing": {
    "action_step_ms": 93817,
    "e2e_ms": null,
    "execution_ms": 93817,
    "input_ms": 1,
    "queue_ms": null,
    "report_ms": null,
    "review_ms": 77806,
    "setup_ms": null
  },
  "variant": "agentic-retrieval",
  "workflow_revision": "pr-review-measure-core-r2"
}
